{
  "id": "daedalus.dotnettest",
  "version": "0.1.0",
  "displayName": ".NET Tests",
  "publisher": "daedalus",
  "description": "Discovers, runs and debugs xUnit, NUnit, MSTest and TUnit tests on VSTest and Microsoft.Testing.Platform, with coverage from Coverlet.",
  "engines": { "daedalus": "^0.2.1" },
  "entry": { "runtime": "dotnet", "assembly": "DaedalusStudio.Plugins.DotNetTest.dll" },
  "isolation": "dedicated",
  "enableProposedApi": true,
  "activationEvents": ["onTestProjects", "onView:testExplorer", "onCommand:dotnettest.createUnitTests"],
  "contributes": {
    "commands": [
      { "id": "dotnettest.createUnitTests", "title": "Create Unit Tests…", "category": "Test" }
    ],
    "menus": {
      "editor/context": [
        { "command": "dotnettest.createUnitTests", "group": "3-tests", "order": 1, "when": "editorLanguageId == csharp" }
      ],
      "menuBar/test": [
        { "command": "dotnettest.createUnitTests", "group": "4-create", "order": 1 }
      ]
    },
    "settings": {
      "title": "Testing",
      "properties": {
        "testing.platform": {
          "type": "string",
          "default": "auto",
          "enum": ["auto", "vstest", "mtp"],
          "enumDescriptions": ["Microsoft.Testing.Platform for projects that enable it, VSTest otherwise", "Always VSTest", "Microsoft.Testing.Platform where the project supports it"],
          "description": "The test platform for projects that support both."
        },
        "testing.runSettingsFile": {
          "type": "string",
          "default": "",
          "description": "A .runsettings file for VSTest projects (relative to the solution folder). Empty: none."
        },
        "testing.targetFramework": {
          "type": "string",
          "default": "",
          "description": "The target framework to test in multi-targeted projects (for example net10.0). Empty: every framework."
        },
        "testing.architecture": {
          "type": "string",
          "default": "",
          "enum": ["", "x64", "x86", "arm64"],
          "enumDescriptions": ["The project's", "x64", "x86", "ARM64"],
          "description": "The process architecture of VSTest test hosts."
        },
        "testing.parallel": {
          "type": "boolean",
          "default": true,
          "description": "Run test projects in parallel (VSTest: MaxCpuCount)."
        },
        "testing.environment": {
          "type": "array",
          "default": [],
          "description": "Environment variables for test processes, as NAME=value."
        },
        "testing.runAfterBuild": {
          "type": "boolean",
          "default": false,
          "description": "After a build, run the tests of the test projects it built."
        },
        "testing.discoverAfterBuild": {
          "type": "boolean",
          "default": true,
          "description": "After a build, ask the test runners for the tests (theories, data rows and generated tests appear)."
        },
        "coverage.include": {
          "type": "array",
          "default": [],
          "description": "Coverlet include filters, such as [MyApp]* (empty: the solution's own non-test projects)."
        },
        "coverage.exclude": {
          "type": "array",
          "default": [],
          "description": "Coverlet exclude filters, such as [*]MyApp.Generated.*."
        }
      }
    }
  }
}
