{
  "id": "daedalus-samples.dictionary-visualizer",
  "version": "1.0.0",
  "displayName": "Dictionary Visualizer",
  "publisher": "daedalus-samples",
  "description": "A sample debugger visualizer: a Dictionary<TKey, TValue> as a table of keys and values.",
  "engines": { "daedalus": "^0.2.7" },
  "entry": { "runtime": "dotnet", "assembly": "DictionaryVisualizer.dll" },
  "enableProposedApi": true,
  "activationEvents": [ "onDebug" ]
}
